{
  "dataset": "mysql_8_0_34_pages",
  "source_pdf": "mysql-8.0.34.pdf",
  "generated_from": "manual PDF analysis",
  "generated_on": "2026-04-15",
  "book": {
    "title": "MySQL 8.0.34",
    "edition": "First Edition",
    "version": "8.0.34",
    "author": "Peter Alvaro & Kyle Kingsbury",
    "date": "2023-12-19"
  },
  "page_numbering": {
    "book_page_to_pdf_page_offset": 0,
    "book_to_pdf_formula": "pdf_page = book_page",
    "pdf_to_book_formula": "book_page = pdf_page",
    "notes": [
      "technical report — pdf_page and book_page are identical",
      "pdf_page matches extracted page ids in mysql_8_0_34_pages.jsonl"
    ]
  },
  "front_matter": [],
  "parts": [],
  "chapters": [
    {
      "chapter": 1,
      "title": "Background",
      "part": null,
      "ranges": {
        "book": {
          "start": 1,
          "end": 4
        },
        "pdf": {
          "start": 1,
          "end": 4
        }
      }
    },
    {
      "chapter": 2,
      "title": "Test Design",
      "part": null,
      "ranges": {
        "book": {
          "start": 4,
          "end": 5
        },
        "pdf": {
          "start": 4,
          "end": 5
        }
      }
    },
    {
      "chapter": 3,
      "title": "Results",
      "part": null,
      "ranges": {
        "book": {
          "start": 5,
          "end": 9
        },
        "pdf": {
          "start": 5,
          "end": 9
        }
      }
    },
    {
      "chapter": 4,
      "title": "Discussion",
      "part": null,
      "ranges": {
        "book": {
          "start": 9,
          "end": 12
        },
        "pdf": {
          "start": 9,
          "end": 12
        }
      }
    }
  ],
  "sections": [
    {
      "section": "1.1",
      "title": "ANSI SQL Isolation is Bad, Actually",
      "chapter": 1,
      "part": null,
      "ranges": {
        "book": {
          "start": 1,
          "end": 3
        },
        "pdf": {
          "start": 1,
          "end": 3
        }
      }
    },
    {
      "section": "1.2",
      "title": "Repeatable Read",
      "chapter": 1,
      "part": null,
      "ranges": {
        "book": {
          "start": 3,
          "end": 3
        },
        "pdf": {
          "start": 3,
          "end": 3
        }
      }
    },
    {
      "section": "1.3",
      "title": "MySQL Isolation",
      "chapter": 1,
      "part": null,
      "ranges": {
        "book": {
          "start": 3,
          "end": 4
        },
        "pdf": {
          "start": 3,
          "end": 4
        }
      }
    },
    {
      "section": "2.1",
      "title": "List Append",
      "chapter": 2,
      "part": null,
      "ranges": {
        "book": {
          "start": 4,
          "end": 4
        },
        "pdf": {
          "start": 4,
          "end": 4
        }
      }
    },
    {
      "section": "2.2",
      "title": "Non-Repeatable Read",
      "chapter": 2,
      "part": null,
      "ranges": {
        "book": {
          "start": 4,
          "end": 5
        },
        "pdf": {
          "start": 4,
          "end": 5
        }
      }
    },
    {
      "section": "2.3",
      "title": "Monotonic Atomic View",
      "chapter": 2,
      "part": null,
      "ranges": {
        "book": {
          "start": 5,
          "end": 5
        },
        "pdf": {
          "start": 5,
          "end": 5
        }
      }
    },
    {
      "section": "2.4",
      "title": "LazyFS",
      "chapter": 2,
      "part": null,
      "ranges": {
        "book": {
          "start": 5,
          "end": 5
        },
        "pdf": {
          "start": 5,
          "end": 5
        }
      }
    },
    {
      "section": "3.1",
      "title": "G2-item at Repeatable Read",
      "chapter": 3,
      "part": null,
      "ranges": {
        "book": {
          "start": 5,
          "end": 5
        },
        "pdf": {
          "start": 5,
          "end": 5
        }
      }
    },
    {
      "section": "3.2",
      "title": "G-single at Repeatable Read",
      "chapter": 3,
      "part": null,
      "ranges": {
        "book": {
          "start": 6,
          "end": 6
        },
        "pdf": {
          "start": 6,
          "end": 6
        }
      }
    },
    {
      "section": "3.3",
      "title": "Lost Update at Repeatable Read",
      "chapter": 3,
      "part": null,
      "ranges": {
        "book": {
          "start": 6,
          "end": 7
        },
        "pdf": {
          "start": 6,
          "end": 7
        }
      }
    },
    {
      "section": "3.4",
      "title": "Non-Repeatable Read at Repeatable Read",
      "chapter": 3,
      "part": null,
      "ranges": {
        "book": {
          "start": 7,
          "end": 8
        },
        "pdf": {
          "start": 7,
          "end": 8
        }
      }
    },
    {
      "section": "3.5",
      "title": "Non-Monotonic View",
      "chapter": 3,
      "part": null,
      "ranges": {
        "book": {
          "start": 8,
          "end": 8
        },
        "pdf": {
          "start": 8,
          "end": 8
        }
      }
    },
    {
      "section": "3.6",
      "title": "Fractured Read-Like Anomalies with RDS Serializable",
      "chapter": 3,
      "part": null,
      "ranges": {
        "book": {
          "start": 8,
          "end": 9
        },
        "pdf": {
          "start": 8,
          "end": 9
        }
      }
    },
    {
      "section": "4.1",
      "title": "Does the MySQL Community Know?",
      "chapter": 4,
      "part": null,
      "ranges": {
        "book": {
          "start": 10,
          "end": 11
        },
        "pdf": {
          "start": 10,
          "end": 11
        }
      }
    },
    {
      "section": "4.2",
      "title": "Recommendations",
      "chapter": 4,
      "part": null,
      "ranges": {
        "book": {
          "start": 11,
          "end": 11
        },
        "pdf": {
          "start": 11,
          "end": 11
        }
      }
    },
    {
      "section": "4.3",
      "title": "RDS",
      "chapter": 4,
      "part": null,
      "ranges": {
        "book": {
          "start": 11,
          "end": 11
        },
        "pdf": {
          "start": 11,
          "end": 11
        }
      }
    },
    {
      "section": "4.4",
      "title": "Future Work",
      "chapter": 4,
      "part": null,
      "ranges": {
        "book": {
          "start": 11,
          "end": 11
        },
        "pdf": {
          "start": 11,
          "end": 11
        }
      }
    },
    {
      "section": "4.5",
      "title": "A Plea to Standards Bodies",
      "chapter": 4,
      "part": null,
      "ranges": {
        "book": {
          "start": 11,
          "end": 12
        },
        "pdf": {
          "start": 11,
          "end": 12
        }
      }
    }
  ],
  "subsections": [],
  "counts": {
    "front_matter": 0,
    "parts": 0,
    "chapters": 4,
    "sections": 18,
    "subsections": 0
  }
}
