{
  "dataset": "scylla_4_2_rc3_pages",
  "source_pdf": "scylla-4.2-rc3.pdf",
  "generated_from": "manual PDF analysis",
  "generated_on": "2026-04-15",
  "book": {
    "title": "Scylla 4.2-rc3",
    "edition": "First Edition",
    "version": "4.2-rc3",
    "author": "Kyle Kingsbury",
    "date": "2020-12-23"
  },
  "page_numbering": {
    "book_page_to_pdf_page_offset": 0,
    "book_to_pdf_formula": "pdf_page = book_page",
    "pdf_to_book_formula": "book_page = pdf_page",
    "notes": [
      "technical report — pdf_page and book_page are identical",
      "pdf_page matches extracted page ids in scylla_4_2_rc3_pages.jsonl"
    ]
  },
  "front_matter": [],
  "parts": [],
  "chapters": [
    {
      "chapter": 1,
      "title": "Background",
      "part": null,
      "ranges": {
        "book": {
          "start": 1,
          "end": 2
        },
        "pdf": {
          "start": 1,
          "end": 2
        }
      }
    },
    {
      "chapter": 2,
      "title": "Test Design",
      "part": null,
      "ranges": {
        "book": {
          "start": 2,
          "end": 2
        },
        "pdf": {
          "start": 2,
          "end": 2
        }
      }
    },
    {
      "chapter": 3,
      "title": "Results",
      "part": null,
      "ranges": {
        "book": {
          "start": 3,
          "end": 7
        },
        "pdf": {
          "start": 3,
          "end": 7
        }
      }
    },
    {
      "chapter": 4,
      "title": "Discussion",
      "part": null,
      "ranges": {
        "book": {
          "start": 7,
          "end": 9
        },
        "pdf": {
          "start": 7,
          "end": 9
        }
      }
    }
  ],
  "sections": [
    {
      "section": "2.1",
      "title": "Workloads",
      "chapter": 2,
      "part": null,
      "ranges": {
        "book": {
          "start": 2,
          "end": 2
        },
        "pdf": {
          "start": 2,
          "end": 2
        }
      }
    },
    {
      "section": "3.1",
      "title": "Destructive INSERTs",
      "chapter": 3,
      "part": null,
      "ranges": {
        "book": {
          "start": 3,
          "end": 4
        },
        "pdf": {
          "start": 3,
          "end": 4
        }
      }
    },
    {
      "section": "3.2",
      "title": "Aborted LWT Reads",
      "chapter": 3,
      "part": null,
      "ranges": {
        "book": {
          "start": 4,
          "end": 4
        },
        "pdf": {
          "start": 4,
          "end": 4
        }
      }
    },
    {
      "section": "3.3",
      "title": "Weird Return Values From Batch Updates #7113",
      "chapter": 3,
      "part": null,
      "ranges": {
        "book": {
          "start": 4,
          "end": 5
        },
        "pdf": {
          "start": 4,
          "end": 5
        }
      }
    },
    {
      "section": "3.4",
      "title": "Normal Writes Are Not Isolated",
      "chapter": 3,
      "part": null,
      "ranges": {
        "book": {
          "start": 5,
          "end": 5
        },
        "pdf": {
          "start": 5,
          "end": 5
        }
      }
    },
    {
      "section": "3.5",
      "title": "LWT Stale Reads",
      "chapter": 3,
      "part": null,
      "ranges": {
        "book": {
          "start": 5,
          "end": 6
        },
        "pdf": {
          "start": 5,
          "end": 6
        }
      }
    },
    {
      "section": "3.6",
      "title": "LWT Split-Brain",
      "chapter": 3,
      "part": null,
      "ranges": {
        "book": {
          "start": 6,
          "end": 6
        },
        "pdf": {
          "start": 6,
          "end": 6
        }
      }
    },
    {
      "section": "3.7",
      "title": "LWT Split-Brain With Membership Changes",
      "chapter": 3,
      "part": null,
      "ranges": {
        "book": {
          "start": 6,
          "end": 7
        },
        "pdf": {
          "start": 6,
          "end": 7
        }
      }
    },
    {
      "section": "4.1",
      "title": "Recommendations",
      "chapter": 4,
      "part": null,
      "ranges": {
        "book": {
          "start": 8,
          "end": 9
        },
        "pdf": {
          "start": 8,
          "end": 9
        }
      }
    },
    {
      "section": "4.2",
      "title": "Future Work",
      "chapter": 4,
      "part": null,
      "ranges": {
        "book": {
          "start": 9,
          "end": 9
        },
        "pdf": {
          "start": 9,
          "end": 9
        }
      }
    }
  ],
  "subsections": [],
  "counts": {
    "front_matter": 0,
    "parts": 0,
    "chapters": 4,
    "sections": 10,
    "subsections": 0
  }
}
